{
  "registry_version": "1.0.0",
  "label_protocol_version": "1.0.0",
  "dataset_classification": "GOVERNED_EVENT_CANDIDATES",
  "training_authorization_status": "NOT_APPROVED",
  "events": [
    {
      "event_id": "caloocan-flood-candidate-2019-06-24",
      "candidate_reference": "candidate-dswd-dromic-2019-06-24-caloocan",
      "hazard_type": "FLOOD",
      "event_start": null,
      "event_end": null,
      "event_time_status": "UNRESOLVED",
      "location_scope": "MULTI_BARANGAY",
      "barangay_psgc": null,
      "latitude": null,
      "longitude": null,
      "source_ids": ["dswd_dromic_caloocan_flood_2019-06-24"],
      "source_document_refs": [
        "ml/flood-risk/data/raw/event-evidence/DSWD-DROMIC-Report-1-on-the-Flooding-Incident-in-Caloocan-City-as-of-28-June-2019-6PM.docx",
        "ml/flood-risk/data/raw/event-evidence/DSWD-DROMIC-Terminal-Report-on-the-Flooding-Incident-in-Caloocan-City-08-Jul-2019-7PM.docx"
      ],
      "evidence_summary": "Two acquired official DSWD DROMIC reports explicitly identify flooding in portions of Caloocan City on 24 June 2019 and name Barangays 175, 176, 177, and 178. Exact onset/end times, coordinates, and the current mapping of legacy Barangay 176 remain unresolved; this is a machine-assisted candidate extraction awaiting an authorized human decision.",
      "label_status": "UNKNOWN",
      "negative_evidence_basis": null,
      "review_status": "REQUIRES_HUMAN_REVIEW",
      "reviewed_by": null,
      "reviewed_at": null,
      "leakage_review_status": "NOT_REVIEWED",
      "training_eligible": false,
      "exclusion_reason": "HUMAN_REVIEW_REQUIRED_EVENT_TIME_AND_LEGACY_BARANGAY_176_MAPPING_UNRESOLVED",
      "candidate_windows": []
    },
    {
      "event_id": "caloocan-flood-candidate-2011-09-27-pedring",
      "candidate_reference": "candidate-ndrrmc-2011-09-27-pedring-caloocan",
      "hazard_type": "FLOOD",
      "event_start": null,
      "event_end": null,
      "event_time_status": "UNRESOLVED",
      "location_scope": "CITY",
      "barangay_psgc": null,
      "latitude": null,
      "longitude": null,
      "source_ids": ["ndrrmc_pedring_sitrep12_2011"],
      "source_document_refs": [],
      "evidence_summary": "Discovery-only NDRRMC metadata explicitly includes Caloocan in a Metro-wide flooding entry dated 27-30 September 2011; source document acquisition and human review are pending.",
      "label_status": "UNKNOWN",
      "negative_evidence_basis": null,
      "review_status": "REQUIRES_HUMAN_REVIEW",
      "reviewed_by": null,
      "reviewed_at": null,
      "leakage_review_status": "NOT_REVIEWED",
      "training_eligible": false,
      "exclusion_reason": "DISCOVERY_ONLY_SOURCE_NOT_ACQUIRED_EVENT_TIME_AND_LOCATION_UNRESOLVED",
      "candidate_windows": []
    },
    {
      "event_id": "caloocan-flood-candidate-2012-08-07-gener-haikui",
      "candidate_reference": "candidate-ndrrmc-2012-08-07-gener-haikui-caloocan",
      "hazard_type": "FLOOD",
      "event_start": null,
      "event_end": null,
      "event_time_status": "UNRESOLVED",
      "location_scope": "CITY",
      "barangay_psgc": null,
      "latitude": null,
      "longitude": null,
      "source_ids": ["ndrrmc_swm_gener_haikui_sitreps_2012"],
      "source_document_refs": [],
      "evidence_summary": "Discovery-only NDRRMC metadata lists three Caloocan roads not passable due to flooding on 7-8 August 2012; the two report revisions are one episode and await acquisition and review.",
      "label_status": "UNKNOWN",
      "negative_evidence_basis": null,
      "review_status": "REQUIRES_HUMAN_REVIEW",
      "reviewed_by": null,
      "reviewed_at": null,
      "leakage_review_status": "NOT_REVIEWED",
      "training_eligible": false,
      "exclusion_reason": "DISCOVERY_ONLY_SOURCE_NOT_ACQUIRED_ONSET_AND_SPATIAL_MAPPING_UNRESOLVED",
      "candidate_windows": []
    },
    {
      "event_id": "caloocan-flood-candidate-2020-11-12-ulysses",
      "candidate_reference": "candidate-ndrrmc-2020-11-12-ulysses-caloocan",
      "hazard_type": "FLOOD",
      "event_start": null,
      "event_end": null,
      "event_time_status": "UNRESOLVED",
      "location_scope": "MULTI_BARANGAY",
      "barangay_psgc": null,
      "latitude": null,
      "longitude": null,
      "source_ids": ["ndrrmc_ulysses_sitreps_2020", "dswd_dromic_ulysses_reports_3_4_2020_11_12", "dswd_dromic_ulysses_terminal_2021_11_13"],
      "source_document_refs": [
        "ml/flood-risk/data/raw/event-evidence/DSWD-DROMIC-Report-3-on-Typhoon-ULYSSES-as-of-12-November-2020-6AM-1.docx",
        "ml/flood-risk/data/raw/event-evidence/DSWD-DROMIC-Report-4-on-Typhoon-ULYSSES-as-of-12-November-2020-6PM-1.docx",
        "ml/flood-risk/data/raw/event-evidence/index.pdf"
      ],
      "evidence_summary": "NDRRMC discovery metadata lists flooding in six numbered Caloocan barangays on 12 November 2020 but its PDFs remain externally inaccessible. Acquired DSWD Report #3 has no Caloocan entry; Report #4 identifies Caloocan with 15 affected barangays, 94 families, and 436 persons and matching evacuation figures as of its 6PM report snapshot. The acquired terminal report later lists 23 affected barangays, 243 families, and 926 persons. None establishes a Caloocan onset or cessation time.",
      "label_status": "UNKNOWN",
      "negative_evidence_basis": null,
      "review_status": "REQUIRES_HUMAN_REVIEW",
      "reviewed_by": null,
      "reviewed_at": null,
      "leakage_review_status": "NOT_REVIEWED",
      "training_eligible": false,
      "exclusion_reason": "DATE_ONLY_EVIDENCE_HUMAN_REVIEW_REQUIRED_NDRRMC_SOURCE_NOT_ACQUIRED_NO_CALOOCAN_ONSET_OR_CESSATION",
      "candidate_windows": []
    },
    {
      "event_id": "caloocan-flood-candidate-2022-08-23-florita",
      "candidate_reference": "candidate-ndrrmc-2022-08-23-florita-caloocan",
      "hazard_type": "FLOOD",
      "event_start": null,
      "event_end": null,
      "event_time_status": "UNRESOLVED",
      "location_scope": "CITY",
      "barangay_psgc": null,
      "latitude": null,
      "longitude": null,
      "source_ids": ["ndrrmc_florita_sitreps_2022", "dswd_dromic_florita_2022_08_25"],
      "source_document_refs": [
        "ml/flood-risk/data/raw/event-evidence/DSWD-DROMIC-Report-1-on-the-Effects-of-Southwest-Monsoon-enhanced-by-STS-Florita-as-of-25-August-2022-6PM.pdf"
      ],
      "evidence_summary": "NDRRMC discovery metadata lists gutter-deep flooding at five Caloocan street locations, but its PDFs remain externally inaccessible. The acquired DSWD report contains no Caloocan reference and reports affected population only in Region VI/Iloilo; its general Metro Manila weather language is not positive Caloocan flood evidence.",
      "label_status": "UNKNOWN",
      "negative_evidence_basis": null,
      "review_status": "REQUIRES_HUMAN_REVIEW",
      "reviewed_by": null,
      "reviewed_at": null,
      "leakage_review_status": "NOT_REVIEWED",
      "training_eligible": false,
      "exclusion_reason": "HUMAN_REVIEW_REQUIRED_NDRRMC_SOURCE_NOT_ACQUIRED_DROMIC_HAS_NO_CALOOCAN_OCCURRENCE_EVIDENCE",
      "candidate_windows": []
    },
    {
      "event_id": "caloocan-flood-candidate-2024-08-28-southwest-monsoon",
      "candidate_reference": "candidate-dswd-dromic-2024-08-28-swm-caloocan",
      "hazard_type": "FLOOD",
      "event_start": null,
      "event_end": null,
      "event_time_status": "UNRESOLVED",
      "location_scope": "CITY",
      "barangay_psgc": null,
      "latitude": null,
      "longitude": null,
      "source_ids": ["dswd_dromic_swm_metro_manila_2024-08-28"],
      "source_document_refs": [],
      "evidence_summary": "Discovery-only DSWD DROMIC metadata explicitly states Caloocan City experienced flooding on 28 August 2024 and reports one unnamed affected barangay; source acquisition and review are pending.",
      "label_status": "UNKNOWN",
      "negative_evidence_basis": null,
      "review_status": "REQUIRES_HUMAN_REVIEW",
      "reviewed_by": null,
      "reviewed_at": null,
      "leakage_review_status": "NOT_REVIEWED",
      "training_eligible": false,
      "exclusion_reason": "DISCOVERY_ONLY_SOURCE_NOT_ACQUIRED_UNNAMED_BARANGAY_AND_EVENT_TIME_UNRESOLVED",
      "candidate_windows": []
    },
    {
      "event_id": "caloocan-flood-candidate-2024-09-02-enteng",
      "candidate_reference": "candidate-ndrrmc-2024-09-02-enteng-caloocan",
      "hazard_type": "FLOOD",
      "event_start": null,
      "event_end": null,
      "event_time_status": "UNRESOLVED",
      "location_scope": "MULTI_BARANGAY",
      "barangay_psgc": null,
      "latitude": null,
      "longitude": null,
      "source_ids": ["ndrrmc_enteng_sitreps_2024", "dswd_dromic_enteng_2024_reports_1_3"],
      "source_document_refs": [
        "ml/flood-risk/data/raw/event-evidence/DSWD-DROMIC-Report-1-on-the-Effects-of-TD-Enteng-and-Southwest-Monsoon-as-of-01-September-2024-6PM.pdf",
        "ml/flood-risk/data/raw/event-evidence/DSWD-DROMIC-Report-2-on-the-Effects-of-Tropical-Storm-Enteng-and-Southwest-Monsoon-as-of-02-September-2024-6AM.pdf",
        "ml/flood-risk/data/raw/event-evidence/DSWD-DROMIC-Report-3-on-the-Effects-of-Tropical-Storm-Enteng-and-Southwest-Monsoon-as-of-02-September-2024-6PM.pdf"
      ],
      "evidence_summary": "Official indexed NDRRMC content supports a candidate ten-location Caloocan episode beginning with listed occurrence points on 02 September 2024 and bounded above by Subsided as of 03 September 8:00am. The source timezone and exact cessation remain unresolved. Crispulo st. changes from a 02 September entry in early revisions to 05 September 07:00 am in later revisions and is not merged automatically. Raw NDRRMC PDFs remain inaccessible; acquired DSWD Reports #1-3 contain no Caloocan reference.",
      "label_status": "UNKNOWN",
      "negative_evidence_basis": null,
      "review_status": "REQUIRES_HUMAN_REVIEW",
      "reviewed_by": null,
      "reviewed_at": null,
      "leakage_review_status": "NOT_REVIEWED",